"Key","SourceString","DevComment"
"da_quest_01_ff_s_gns_gorgon_snake.m_Objectives(2).m_Objectives.Description","Убейте змею Горгону и получите ее кровь",""
"da_quest_01_ff_s_gns_gorgon_snake.m_Objectives(3).m_Objectives.Description","Принесите змеиную кровь для Лалаж",""
"da_quest_01_ff_s_gns_gorgon_snake.m_Objectives(4).m_Objectives.Description","Дайте Иссе лекарство от змеиного яда",""
"da_quest_01_ff_s_gs_statue_pieces.m_Title","Разбитый бог",""
"da_quest_01_ff_s_gs_statue_pieces.m_HighVisionGoal","Соберите статую Главка",""
"da_quest_01_ff_s_gs_statue_pieces.m_CompletedGoal","Я нашел все части статуи и собрал ее заново.",""
"da_quest_01_ff_s_gs_statue_pieces.m_Summary","Статуя Главка была разбита на куски во время наводнения. Если я найду все части и соберу их у основания статуи, местные жители наверняка будут мне благодарны.",""
"da_quest_01_ff_s_gs_statue_pieces.m_CompletedSummary","Я собрал статую Главка, чтобы вернуть надежду местным жителям, отчаявшимся из-за отсутствия своего бога.",""
"da_quest_01_ff_s_gs_statue_pieces.m_Objectives(0).m_Objectives.Description","Найдите голову",""
"da_quest_01_ff_s_gs_statue_pieces.m_Objectives(1).m_Objectives.Description","Найдите хвост",""
"da_quest_01_ff_s_gs_statue_pieces.m_Objectives(2).m_Objectives.Description","Найдите торс",""
"da_quest_01_ff_s_gs_statue_pieces.m_Objectives(3).m_Objectives.Description","Найдите посох",""
"da_quest_01_ff_s_gs_statue_pieces.m_Objectives(4).m_Objectives.Description","Принесите части статуи к основанию",""
"da_quest_01_ff_s_gs_statue_pieces.m_Objectives(5).m_Objectives.Description","Найдите основание статуи",""
"da_quest_01_ff_s_gy_graveyard.m_Title","Обряды погребения",""
"da_quest_01_ff_s_gy_graveyard.m_HighVisionGoal","Я должен выяснить, почему мертвые восстают, и упокоить их.",""
"da_quest_01_ff_s_gy_graveyard.m_CompletedGoal","Я упокоил призраков героя Аристомена и его боевых товарищей.",""
"da_quest_01_ff_s_gy_graveyard.m_Summary","Жители Пиргоса не могут похоронить своих умерших после нападения ихтианов, потому что наводнение повредило кладбище и нарушило обряд погребения. Хранительнице могил Нефеле нужна моя помощь, чтобы упокоить нежить.",""
"da_quest_01_ff_s_gy_graveyard.m_CompletedSummary","Древний герой Аристомен вернулся из мертвых, считая, что его обязанность — снова защищать Пиргос от ихтианов. Бедная, запутавшаяся душа. Я упокоил его и его спутников. Теперь смотритель могил должен упокоить остальных мертвецов.",""
"da_quest_01_ff_s_gy_graveyard.m_Objectives(0).m_Objectives.Description","Поговорите с охранником кладбища",""
"da_quest_01_ff_s_gy_graveyard.m_Objectives(1).m_Objectives.Description","Найдите хранительницу могил Нефелу",""
"da_quest_01_ff_s_gy_graveyard.m_Objectives(2).m_Objectives.Description","Встретьтесь с Нефелой у внутренних ворот",""
"da_quest_01_ff_s_gy_graveyard.m_Objectives(3).m_Objectives.Description","Подожгите благовония в гробнице Аристомена",""
"da_quest_01_ff_s_gy_graveyard.m_Objectives(4).m_Objectives.Description","Найдите способ получить доступ к гробнице Аристомена",""
"da_quest_01_ff_s_gy_graveyard.m_Objectives(5).m_Objectives.Description","Упокойте Гиллея",""
"da_quest_01_ff_s_gy_graveyard.m_Objectives(6).m_Objectives.Description","Упокойте Отонию",""
"da_quest_01_ff_s_gy_graveyard.m_Objectives(7).m_Objectives.Description","Упокойте Тидея",""
"da_quest_01_ff_s_gy_graveyard.m_Objectives(8).m_Objectives.Description","Победите Аристомена и отправьте его на покой",""
"da_quest_01_ff_s_gy_graveyard.m_QuestInformation(0).m_QuestInformation.HighVisionGoal","Я должен упокоить древних героев, которые будоражат мертвых.",""
"da_quest_01_ff_s_hh_headhunter.m_Title","Охота за головами",""
"da_quest_01_ff_s_hh_headhunter.m_HighVisionGoal","Я должен победить любого ихтианских командиров, которых найду, и доложить лохагосу Ризону.",""
"da_quest_01_ff_s_hh_headhunter.m_CompletedGoal","Я убил всех четырех ихтианских командиров.",""
"da_quest_01_ff_s_hh_headhunter.m_Summary","Я убил сильного ихтиана, с которого подобрал «медальон командира». Лохагос Ризон, несомненно, будет счастлив увидеть его и будет рад, если я уберу других командиров.",""
"da_quest_01_ff_s_hh_headhunter.m_CompletedSummary","Я зачистил ихтианских командиров в этой области и в качестве доказательства принес медальоны лохагосу Ризону.",""
"da_quest_01_ff_s_hh_headhunter.m_Objectives(0).m_Objectives.Description","Убейте ихтиана-командира на востоке",""
"da_quest_01_ff_s_hh_headhunter.m_Objectives(1).m_Objectives.Description","Убейте ихтиана-командира на юге",""
"da_quest_01_ff_s_hh_headhunter.m_Objectives(2).m_Objectives.Description","Убейте ихтиана-командира на западе",""
"da_quest_01_ff_s_hh_headhunter.m_Objectives(3).m_Objectives.Description","Убейте ихтиана-командира на севере",""
"da_quest_01_ff_s_hh_headhunter.m_Objectives(4).m_Objectives.Description","Вернитесь к лохагосу Ризону",""
"da_quest_01_ff_s_hh_headhunter.m_QuestInformation(0).m_QuestInformation.HighVisionGoal","Принесите лохагосу Ризону четыре медальона ихтианов-командиров",""
"da_quest_01_ff_s_hh_headhunter.m_QuestInformation(0).m_QuestInformation.Summary","Четыре ихтианских командира разбросаны по затопленным фермам. Их устранение окажет ополченцам серьезную поддержку.",""
"da_quest_01_ff_s_hs_hermes_shrine.m_Title","Святилище трикстера",""
"da_quest_01_ff_s_hs_hermes_shrine.m_HighVisionGoal","Получите благословение святилища",""
"da_quest_01_ff_s_hs_hermes_shrine.m_CompletedGoal","Я получил благословение из храма Гермеса",""
"da_quest_01_ff_s_hs_hermes_shrine.m_Summary","Я отремонтировал старое святилище, на котором обнаружился следующий текст: «Вы, желающие благословения Гермеса / Бога путешественников, гонцов, хитрости и торговли / Принесите сюда зверя, из которого Гермес сделал первую лиру / И принесите его в жертву перед алтарем, пролив его кровь на эту землю».",""
"da_quest_01_ff_s_hs_hermes_shrine.m_CompletedSummary","Я выполнил требования святилища, принес ему в жертву черепаху и получил благословение.",""
"da_quest_01_ff_s_hs_hermes_shrine.m_Objectives(0).m_Objectives.Description","Сделайте то, о чем говорит надпись на святыне",""
"da_quest_01_ff_s_mc_missing_cows.m_Title","Пропавшие коровы",""
"da_quest_01_ff_s_mc_missing_cows.m_HighVisionGoal","Разрешите конфликт между Столосом и беженцами анклава",""
"da_quest_01_ff_s_mc_missing_cows.m_CompletedGoal","Я разрешил конфликт между Столосом и беженцами анклава.",""
"da_quest_01_ff_s_mc_missing_cows.m_Summary","Столос, фермер, владеющий землей анклава, обижен на беженцев и отказывается делиться с ними едой. Исса, предводительница беженцев, нуждается в помощи, чтобы разрешить ситуацию.",""
"da_quest_01_ff_s_mc_missing_cows.m_CompletedSummary","Оказывается, Столос был зол на беженцев из Пиргоса по вполне понятной причине — тридцать лет назад жители Пиргоса отказались помочь спасти его жену. Исса извинилась от имени города, и Столос согласился поделиться с ним едой.",""
"da_quest_01_ff_s_mc_missing_cows.m_Objectives(0).m_Objectives.Description","Поговорите с Иссой",""
"da_quest_01_ff_s_mc_missing_cows.m_Objectives(1).m_Objectives.Description","Найдите коров",""
"da_quest_01_ff_s_mc_missing_cows.m_Objectives(2).m_Objectives.Description","Приведите коров домой к Столосу",""
"da_quest_01_ff_s_mc_missing_cows.m_Objectives(3).m_Objectives.Description","Поговорите с Иссой и Столосом",""
"da_quest_01_ff_s_mc_missing_cows.m_Objectives(4).m_Objectives.Description","Поговорите с Лалаж",""
"da_quest_01_ff_s_mc_missing_cows.m_Objectives(5).m_Objectives.Description","Разыщите старика Тона",""
"da_quest_01_ff_s_mc_missing_cows.m_Objectives(6).m_Objectives.Description","Поговорите со стариком Тоном",""
"da_quest_01_ff_s_mc_missing_cows.m_Objectives(7).m_Objectives.Description","Вернитесь к Лалаж с Иссой",""
"da_quest_01_ff_s_mc_missing_cows.m_Objectives(8).m_Objectives.Description","Принесите зелье для Столоса",""
"da_quest_01_ff_s_mh_modern_hero.m_Title","Героический дух",""
"da_quest_01_ff_s_mh_modern_hero.m_HighVisionGoal","Помогите Кенею",""
"da_quest_01_ff_s_mh_modern_hero.m_CompletedGoal","Я помог Кенею победить нападение ихтианов и вернуть меч.",""
"da_quest_01_ff_s_mh_modern_hero.m_Summary","Мне рассказали о Кенее, воине из Пиргоса, который пропал на уединенном пляже на севере.",""
"da_quest_01_ff_s_mh_modern_hero.m_CompletedSummary","Я встретил дружественного духа по имени Кеней, и мы вместе победили ихтианскую атаку. Меч Кенея был украден ихтианом, и я нашел его для него, но он попросил оставить его себе.",""
"da_quest_01_ff_s_mh_modern_hero.m_Objectives(0).m_Objectives.Description","Найдите Кенея",""
"da_quest_01_ff_s_mh_modern_hero.m_Objectives(1).m_Objectives.Description","Присоединитесь к дружескому духу в бою",""
"da_quest_01_ff_s_mh_modern_hero.m_Objectives(2).m_Objectives.Description","Победите ихтианов вместе с Кенеем",""
"da_quest_01_ff_s_mh_modern_hero.m_Objectives(3).m_Objectives.Description","Поговорите с Кенеем",""
"da_quest_01_ff_s_mh_modern_hero.m_Objectives(4).m_Objectives.Description","Найдите меч Кенея",""
"da_quest_01_ff_s_mh_modern_hero.m_Objectives(5).m_Objectives.Description","Верните Кенею его меч",""
"da_quest_01_ff_s_mh_modern_hero.m_QuestInformation(0).m_QuestInformation.Summary","Я наткнулся на дружелюбного духа по имени Кеней, сражающегося с ихтианами на пляже. Он призвал меня присоединиться к нему в битве.",""
"da_quest_01_ff_s_mi_minyade.m_Title","Крылья и клыки",""
"da_quest_01_ff_s_mi_minyade.m_HighVisionGoal","Покончите с нападениями миньяд",""
"da_quest_01_ff_s_mi_minyade.m_CompletedGoal","Я покончил с шумом, который беспокоил миньяд.",""
"da_quest_01_ff_s_mi_minyade.m_Summary","Похожие на летучих мышей монстры, называемые миньядами, нападают на людей в окрестностях Пиргоса. Нужно с ними разобраться.",""
"da_quest_01_ff_s_mi_minyade.m_CompletedSummary","Я обнаружил, что миньяд разозлили шумные ихтианы. Я убил ихтианов и заключил мир с миньядами.",""
"da_quest_01_ff_s_mi_minyade.m_Objectives(0).m_Objectives.Description","Узнайте, что взволновало миньяд",""
"da_quest_01_ff_s_mi_minyade.m_Objectives(1).m_Objectives.Description","Найдите причину нападения миньяд",""
"da_quest_01_ff_s_mi_minyade.m_Objectives(2).m_Objectives.Description","Убейте шумных ихтианов",""
"da_quest_01_ff_s_mi_minyade.m_Objectives(3).m_Objectives.Description","Поговорите с миньядой-предводительницей",""
"da_quest_01_ff_s_mi_minyade.m_Objectives(4).m_Objectives.Description","Поговорите с Отусом",""
"da_quest_01_ff_s_mr_militia_resolve.m_Title","Дым над Пиргосом",""
"da_quest_01_ff_s_mr_militia_resolve.m_HighVisionGoal","Остановите вражеские дымовые сигналы на обзорной площадке",""
"da_quest_01_ff_s_mr_militia_resolve.m_CompletedGoal","Я помог ополченцам уничтожить дымовые сигналы.",""
"da_quest_01_ff_s_mr_militia_resolve.m_Summary","Группе солдат ополчения поручено остановить дымовые сигналы ихтиан для нападения на Пиргос. Им нужна моя помощь.",""
"da_quest_01_ff_s_mr_militia_resolve.m_CompletedSummary","Я помог ополченцам захватить Смотровую площадку и остановить дымовые сигналы, которые ихтианы использовали для координации атак на Пиргос.",""
"da_quest_01_ff_s_mr_militia_resolve.m_Objectives(0).m_Objectives.Description","Помогите ополченцам уничтожить дымовые сигналы",""
"da_quest_01_ff_s_mr_militia_resolve.m_Objectives(1).m_Objectives.Description","Помогите ополчению отбиться от ихтианов",""
"da_quest_01_ff_s_mr_militia_resolve.m_Objectives(2).m_Objectives.Description","Займите холм",""
"da_quest_01_ff_s_mr_militia_resolve.m_Objectives(3).m_Objectives.Description","Уничтожьте дымовой сигнал",""
"da_quest_01_ff_s_mr_militia_resolve.m_Objectives(4).m_Objectives.Description","Разбейте контрнаступление",""
"da_quest_01_ff_s_mr_militia_resolve.m_Objectives(5).m_Objectives.Description","Поговорите с Ниреем",""
"da_quest_01_ff_s_mr_militia_resolve.m_Objectives(6).m_Objectives.Description","Вернитесь к пентеконтору Хрисе",""
"da_quest_01_ff_s_ng_naiad_and_goats.m_Title","Наяда и козлята",""
"da_quest_01_ff_s_ng_naiad_and_goats.m_HighVisionGoal","Я должен найти способ поговорить с наядой.",""
"da_quest_01_ff_s_ng_naiad_and_goats.m_CompletedGoal","Я поговорил с наядой и освободил ее коз.",""
"da_quest_01_ff_s_ng_naiad_and_goats.m_Summary","Я нашел наяду, окруженную стадом коз. Но когда я приблизился к ее роще, она превратила и меня в козла. Мне повезло, что я спасся. Арион считает, что корень моли может помочь противостоять магии превращения наяд. Чаще всего он растет возле храмов и святилищ.",""
"da_quest_01_ff_s_ng_naiad_and_goats.m_CompletedSummary","Человеческий эгоизм не знает границ. Разбойник лишил наяду ее драгоценной лилии, и она решила отомстить другим, превратив их в козлов. Мне удалось вернуть лилию, и наяда освободила своих пленников.",""
"da_quest_01_ff_s_ng_naiad_and_goats.m_Objectives(0).m_Objectives.Description","Найдите корень моли",""
"da_quest_01_ff_s_ng_naiad_and_goats.m_Objectives(1).m_Objectives.Description","Съешьте корень моли и поговорите с наядой",""
"da_quest_01_ff_s_ng_naiad_and_goats.m_Objectives(2).m_Objectives.Description","Найдите лилию",""
"da_quest_01_ff_s_ng_naiad_and_goats.m_Objectives(3).m_Objectives.Description","Верните священную лилию",""
"da_quest_01_ff_s_ng_naiad_and_goats.m_QuestInformation(0).m_QuestInformation.HighVisionGoal","Я должен найти и вернуть священную лилию наяд.",""
"da_quest_01_ff_s_ng_naiad_and_goats.m_QuestInformation(0).m_QuestInformation.Summary","Наяда превратила группу фермеров в козлов, потому что у нее украли священную лилию.",""
"da_quest_01_ff_s_pc_prisoner_cave.m_Title","Клетки в темноте",""
"da_quest_01_ff_s_pc_prisoner_cave.m_HighVisionGoal","Спасите заключенных.",""
"da_quest_01_ff_s_pc_prisoner_cave.m_CompletedGoal","Я вызволил пленников из ихтианского плена.",""
"da_quest_01_ff_s_pc_prisoner_cave.m_Summary","Местные жители оказались заточены ихтианами в пещере. Если их не спасти, кто знает, какая ужасная участь уготована ихтианам?",""
"da_quest_01_ff_s_pc_prisoner_cave.m_CompletedSummary","Я освободил пленников из клеток, в которых их держали ихтианы, и позаботился о том, чтобы они добрались до безопасного места.",""
"da_quest_01_ff_s_pc_prisoner_cave.m_Objectives(0).m_Objectives.Description","Помогите заключенным выбраться из пещеры",""
"da_quest_01_ff_s_pc_prisoner_cave.m_Objectives(1).m_Objectives.Description","Убедитесь, что заключенные благополучно выбрались на свободу",""
"da_quest_01_ff_s_rl_raiders_landing.m_Title","Часть гордости",""
"da_quest_01_ff_s_rl_raiders_landing.m_HighVisionGoal","Найдите Онетаса",""
"da_quest_01_ff_s_rl_raiders_landing.m_CompletedGoal","Я убил Онетаса и спас людей, которых он похитил.",""
"da_quest_01_ff_s_rl_raiders_landing.m_Summary","Я наткнулся на лагерь группы под названием «Бронзовые львы», которая, похоже, заинтересована в том, чтобы завербовать меня. Они посоветовали мне поговорить с их лидером, Онетасом.",""
"da_quest_01_ff_s_rl_raiders_landing.m_CompletedSummary","Лагерь бандитов, называющих себя «Бронзовые львы», пытался завербовать меня, но я понял, что они насильно вербуют местных жителей, поэтому я положил им конец.",""
"da_quest_01_ff_s_rl_raiders_landing.m_Objectives(0).m_Objectives.Description","Найдите и поговорите с Онетасом",""
"da_quest_01_ff_s_rl_raiders_landing.m_Objectives(1).m_Objectives.Description","Убейте Онетаса",""
"da_quest_01_ff_s_rl_raiders_landing.m_Objectives(2).m_Objectives.Description","Проверьте Аластора и Бороса",""
"da_quest_01_ff_s_rl_raiders_landing.m_QuestInformation(0).m_QuestInformation.HighVisionGoal","Покончите с угрозой Бронзовых львов",""
"da_quest_01_ff_s_sp_stone_poet.m_Title","Каменный поэт",""
"da_quest_01_ff_s_sp_stone_poet.m_HighVisionGoal","Исследуйте тайну руин Эраны.",""
"da_quest_01_ff_s_sp_stone_poet.m_CompletedGoal","Я победил статую гиппокампуса.",""
"da_quest_01_ff_s_sp_stone_poet.m_Summary","Я наткнулся на таинственные руины и услышал странный, но дружелюбный голос, манящий меня ближе.",""
"da_quest_01_ff_s_sp_stone_poet.m_CompletedSummary","Волшебная статуя гиппокампуса заманила меня поближе, заманив дружелюбным чтением поэмы, но это была ловушка! Я победил ее, положив конец ее злу.",""
"da_quest_01_ff_s_sp_stone_poet.m_Objectives(0).m_Objectives.Description","Найдите источник таинственного голоса",""
"da_quest_01_ff_s_sp_stone_poet.m_Objectives(1).m_Objectives.Description","Поговорите с волшебной статуей гиппокампуса",""
"da_quest_01_ff_s_sp_stone_poet.m_Objectives(2).m_Objectives.Description","Победите призванных гиппокампусом крабов",""
"da_quest_01_ff_s_sp_stone_poet.m_Objectives(3).m_Objectives.Description","Победите Гиппокампуса",""
"da_quest_01_ff_s_sp_stone_poet.m_QuestInformation(0).m_QuestInformation.HighVisionGoal","Гиппокампос — зло, и с ним нужно разобраться.",""
