"Key","SourceString","DevComment"
"da_quest_01_ff_m_bs_prehub.m_Title","На странном берегу",""
"da_quest_01_ff_m_bs_prehub.m_HighVisionGoal","Я должен узнать, куда меня отправили Судьбы.",""
"da_quest_01_ff_m_bs_prehub.m_CompletedGoal","Я добрался до Пиргоса, деревни, осажденной ихтианами. Местный бог Главк должен помочь мне добраться до Мойр — если, конечно, я смогу их найти.",""
"da_quest_01_ff_m_bs_prehub.m_Summary","Моя наставница Аристоноя мертва. Богиня Немезида убила ее, а затем преследовала меня через море. Я бы утонул, если бы не амулет, который дала мне моя наставница. Я понятия не имею, где нахожусь и как найти Мойр, как того желала Аристоноя.",""
"da_quest_01_ff_m_bs_prehub.m_CompletedSummary","Меня выбросило на берег, но я не один. В амулете Аристонои живет дух божественного коня Ариона. Он дружит с богом Главком, который может помочь мне добраться до храма Мойр. Возможно, боги все-таки улыбаются мне.",""
"da_quest_01_ff_m_bs_prehub.m_Objectives(0).m_Objectives.Description","Найдите бога, который поможет достичь Мойр",""
"da_quest_01_ff_m_bs_prehub.m_Objectives(1).m_Objectives.Description","Главк может вам помочь",""
"da_quest_01_ff_m_bs_prehub.m_Objectives(2).m_Objectives.Description","Исследуйте пляж",""
"da_quest_01_ff_m_bs_prehub.m_Objectives(3).m_Objectives.Description","Следуйте за голосом",""
"da_quest_01_ff_m_bs_prehub.m_Objectives(4).m_Objectives.Description","Спасите Ариона от крабов",""
"da_quest_01_ff_m_bs_prehub.m_Objectives(5).m_Objectives.Description","Следуйте по дороге",""
"da_quest_01_ff_m_bs_prehub.m_Objectives(6).m_Objectives.Description","Пройдите через пещеру",""
"da_quest_01_ff_m_bs_prehub.m_Objectives(7).m_Objectives.Description","Продолжайте идти по дороге",""
"da_quest_01_ff_m_bs_prehub.m_Objectives(8).m_Objectives.Description","Победите ихтианов",""
"da_quest_01_ff_m_bs_prehub.m_Objectives(9).m_Objectives.Description","Уничтожьте мост",""
"da_quest_01_ff_m_bs_prehub.m_Objectives(10).m_Objectives.Description","Отправляйтесь к деревне Пиргос вместе с Филоном",""
"da_quest_01_ff_m_bs_prehub.m_Objectives(11).m_Objectives.Description","Победите ихтианов у святилища Главка",""
"da_quest_01_ff_m_bs_prehub.m_Objectives(12).m_Objectives.Description","Поговорите с Филоном",""
"da_quest_01_ff_m_bs_prehub.m_Objectives(13).m_Objectives.Description","Войдите в деревню Пиргос",""
"da_quest_01_ff_m_bs_prehub.m_QuestInformation(0).m_QuestInformation.HighVisionGoal","Ко мне воззвал голос из амулета, подаренного Аристоноей. Должно быть, его выбросило на берег неподалеку. Надо поискать.",""
"da_quest_01_ff_m_bs_prehub.m_QuestInformation(1).m_QuestInformation.HighVisionGoal","Мне следует поискать деревню, чтобы узнать, как добраться до храма Мойр.",""
"da_quest_01_ff_m_bs_prehub.m_QuestInformation(2).m_QuestInformation.HighVisionGoal","На главной дороге я нашел незнакомца, на которого напали ихтианы. Возможно, он поможет мне найти Мойр.",""
"da_quest_01_ff_m_bs_prehub.m_QuestInformation(3).m_QuestInformation.HighVisionGoal","Арион считает, что бог Главк может помочь нам добраться до Мойр. Я должен продолжить путь в деревню Пиргос и найти храм Главка.",""
"da_quest_01_ff_m_bs_rizons_recruitment.m_Title","Город на холме",""
"da_quest_01_ff_m_bs_rizons_recruitment.m_HighVisionGoal","Найдите путь через Пиргос, чтобы разыскать Главка",""
"da_quest_01_ff_m_bs_rizons_recruitment.m_CompletedGoal","Я вступил в ополчение Пиргоса и получил доступ к лифту.",""
"da_quest_01_ff_m_bs_rizons_recruitment.m_Summary","Из-за ихтианской угрозы лифт Пиргоса закрыт для всех, кроме ополченцев. Мне нужно вступить в ополчение, если я хочу найти Главка.",""
"da_quest_01_ff_m_bs_rizons_recruitment.m_CompletedSummary","Я проявил себя перед лохагосом Ризоном и вступил в ополчение Пиргоса.",""
"da_quest_01_ff_m_bs_rizons_recruitment.m_Objectives(0).m_Objectives.Description","Найдите дальнейший путь через Пиргос",""
"da_quest_01_ff_m_bs_rizons_recruitment.m_Objectives(1).m_Objectives.Description","Найдите способ добраться до лифта из Пиргоса",""
"da_quest_01_ff_m_bs_rizons_recruitment.m_Objectives(2).m_Objectives.Description","Поговорите с лохагосом Ризоном о вступлении в ополчение",""
"da_quest_01_ff_m_bs_rizons_recruitment.m_Objectives(3).m_Objectives.Description","Победите ихтиана-дикаря",""
"da_quest_01_ff_m_bs_rizons_recruitment.m_Objectives(4).m_Objectives.Description","Поговорите с лохагосом Ризоном",""
"da_quest_01_ff_m_bs_rizons_recruitment.m_QuestInformation(0).m_QuestInformation.HighVisionGoal","Присоединитесь к ополчению, чтобы получить доступ к затопленным угодьям",""
"da_quest_01_ff_m_bs_rizons_recruitment.m_QuestInformation(1).m_QuestInformation.HighVisionGoal","Никто не может подняться на лифте из Пиргоса, если не состоит в ополчении. Мне следует подумать о вступлении в ополчение, чтобы я мог [искать Глаукуса]...",""
"da_quest_01_ff_m_bs_rizons_recruitment.m_QuestInformation(2).m_QuestInformation.Summary","Из-за ихтианской угрозы лифт Пиргоса закрыт для всех, кроме ополченцев. Мне нужно вступить в ополчение, если я хочу [продолжить поиски].",""
"da_quest_01_ff_embers_of_the_night.m_Title","Старинные угли",""
"da_quest_01_ff_embers_of_the_night.m_HighVisionGoal","Найдите применение уголькам ночи",""
"da_quest_01_ff_embers_of_the_night.m_CompletedGoal","Я обменял угольки ночи на награды у Ианты",""
"da_quest_01_ff_embers_of_the_night.m_Summary","Я нашел Угольки ночи, странные скопления магии, пульсирующие темной энергией. Они кажутся ценными, возможно, кто-то в Пиргосе заинтересуется ими.",""
"da_quest_01_ff_embers_of_the_night.m_CompletedSummary","Я нашел старушку по имени Ианта, которая изучает микенцев. Она дала мне вознаграждение в обмен на Угольки ночи.",""
"da_quest_01_ff_embers_of_the_night.m_Objectives(0).m_Objectives.Description","Найдите кого-то, кто знает про угольки ночи",""
"da_quest_01_ff_embers_of_the_night.m_Objectives(1).m_Objectives.Description","Найдите уголек ночи",""
"da_quest_01_ff_embers_of_the_night.m_Objectives(2).m_Objectives.Description","Вернитесь к Ианте с угольком ночи",""
"da_quest_01_ff_embers_of_the_night.m_Objectives(3).m_Objectives.Description","Найдите 30 угольков ночи",""
"da_quest_01_ff_embers_of_the_night.m_Objectives(4).m_Objectives.Description","Вернитесь к Ианте с первой партией угольков ночи.",""
"da_quest_01_ff_embers_of_the_night.m_Objectives(5).m_Objectives.Description","Найдите 30 угольков ночи",""
"da_quest_01_ff_embers_of_the_night.m_Objectives(6).m_Objectives.Description","Вернитесь к Ианте со второй партией угольков ночи.",""
"da_quest_01_ff_embers_of_the_night.m_Objectives(7).m_Objectives.Description","Найдите 30 угольков ночи",""
"da_quest_01_ff_embers_of_the_night.m_Objectives(8).m_Objectives.Description","Вернитесь к Ианте с третьей партией угольков ночи.",""
"da_quest_01_ff_embers_of_the_night.m_Objectives(9).m_Objectives.Description","Найдите 30 угольков ночи",""
"da_quest_01_ff_embers_of_the_night.m_Objectives(10).m_Objectives.Description","Вернитесь к Ианте с четвертой партией угольков ночи.",""
"da_quest_01_ff_embers_of_the_night.m_Objectives(11).m_Objectives.Description","Найдите 30 угольков ночи",""
"da_quest_01_ff_embers_of_the_night.m_Objectives(12).m_Objectives.Description","Вернитесь к Ианте с пятой партией угольков ночи.",""
"da_quest_01_ff_embers_of_the_night.m_Objectives(13).m_Objectives.Description","Найдите 30 угольков ночи",""
"da_quest_01_ff_embers_of_the_night.m_Objectives(14).m_Objectives.Description","Вернитесь к Ианте с шестой партией угольков ночи.",""
"da_quest_01_ff_embers_of_the_night.m_Objectives(15).m_Objectives.Description","Найдите 30 угольков ночи",""
"da_quest_01_ff_embers_of_the_night.m_Objectives(16).m_Objectives.Description","Вернитесь к Ианте с седьмой партией угольков ночи.",""
"da_quest_01_ff_m_ds_desecrated_shrine.m_Title","В поисках морского бога",""
"da_quest_01_ff_m_ds_desecrated_shrine.m_HighVisionGoal","Мне следует отправиться в храм Главка и попросить бога помочь мне добраться до храма Мойр.",""
"da_quest_01_ff_m_ds_desecrated_shrine.m_CompletedGoal","Похоже, что бог Главк покинул этот регион.",""
"da_quest_01_ff_m_ds_desecrated_shrine.m_Summary","Мне нужно поговорить с Мойрами о том, почему Немезида охотится на меня, но только бог может привести меня к ним. Арион верит, что его старый друг, бог Главк, может помочь, поэтому я ищу Главка в его храме.",""
"da_quest_01_ff_m_ds_desecrated_shrine.m_CompletedSummary","Храм Главка находился в ужасном состоянии. Ихтианы обнаружили в крипте храма Ихор титана и пытались принести ему в жертву жрицу Главка. Я поглотил ихор и освободил жрицу, но она не смогла призвать Главка. Похоже, бог действительно пропал. Я должен найти другой способ добраться до Мойр.",""
"da_quest_01_ff_m_ds_desecrated_shrine.m_Objectives(0).m_Objectives.Description","Отправляйтесь в храм Главка",""
"da_quest_01_ff_m_ds_desecrated_shrine.m_Objectives(1).m_Objectives.Description","Поговорите с Филоном",""
"da_quest_01_ff_m_ds_desecrated_shrine.m_Objectives(2).m_Objectives.Description","Найдите пленников",""
"da_quest_01_ff_m_ds_desecrated_shrine.m_Objectives(3).m_Objectives.Description","Освободите заключенного",""
"da_quest_01_ff_m_ds_desecrated_shrine.m_Objectives(4).m_Objectives.Description","Войдите в склеп",""
"da_quest_01_ff_m_ds_desecrated_shrine.m_Objectives(5).m_Objectives.Description","Найдите жрицу",""
"da_quest_01_ff_m_ds_desecrated_shrine.m_Objectives(6).m_Objectives.Description","Прикоснитесь к ихору титана",""
"da_quest_01_ff_m_ds_desecrated_shrine.m_Objectives(7).m_Objectives.Description","Победите врагов",""
"da_quest_01_ff_m_ds_desecrated_shrine.m_Objectives(8).m_Objectives.Description","Проверьте жрицу",""
"da_quest_01_ff_m_ds_desecrated_shrine.m_Objectives(9).m_Objectives.Description","Прикоснитесь к ихору титана",""
"da_quest_01_ff_m_ds_desecrated_shrine.m_Objectives(10).m_Objectives.Description","Покиньте склеп",""
"da_quest_01_ff_m_ds_desecrated_shrine.m_Objectives(11).m_Objectives.Description","Поговорите со жрицей",""
"da_quest_01_ff_m_ds_desecrated_shrine.m_QuestInformation(0).m_QuestInformation.HighVisionGoal","Ихтиане захватили храм и взяли пленных. Я должен найти и освободить их.",""
"da_quest_01_ff_m_ds_desecrated_shrine.m_QuestInformation(1).m_QuestInformation.HighVisionGoal","Ихтиане захватили жрицу Главка. Я должен освободить ее.",""
"da_quest_01_ff_m_ds_desecrated_shrine.m_QuestInformation(2).m_QuestInformation.HighVisionGoal","Я освободил жрицу. Она призовет для меня Главка. Я должен встретиться с ней в храме.",""
"da_quest_01_ff_m_moc_moirai_cave.m_Title","Шепот Мойры",""
"da_quest_01_ff_m_moc_moirai_cave.m_HighVisionGoal","Поговорите с Мойрами",""
"da_quest_01_ff_m_moc_moirai_cave.m_CompletedGoal","Я поговорил с Мойрами.",""
"da_quest_01_ff_m_moc_moirai_cave.m_Summary","Аристоноя сказала мне, что единственная надежда выжить против Немезиды — обратиться к Судьбам. Пришло время встретиться с ними.",""
"da_quest_01_ff_m_moc_moirai_cave.m_CompletedSummary","Я посоветовался с Судьбами, и они дали мне пророчество, а также специальную амфору, которая позволит мне поглотить энергию Немезиды.",""
"da_quest_01_ff_m_moc_moirai_cave.m_Objectives(0).m_Objectives.Description","Встретьтесь с Главком в северном горном массиве",""
"da_quest_01_ff_m_moc_moirai_cave.m_Objectives(1).m_Objectives.Description","Войдите в храм Мойры",""
"da_quest_01_ff_m_moc_moirai_cave.m_Objectives(2).m_Objectives.Description","Найдите путь через храм",""
"da_quest_01_ff_m_moc_moirai_cave.m_Objectives(3).m_Objectives.Description","Убейте всех предвестников Немезиды",""
"da_quest_01_ff_m_moc_moirai_cave.m_Objectives(4).m_Objectives.Description","Осмотрите статую",""
"da_quest_01_ff_m_moc_moirai_cave.m_Objectives(5).m_Objectives.Description","Выясните причину появления войск Немезиды в храме",""
"da_quest_01_ff_m_moc_moirai_cave.m_Objectives(6).m_Objectives.Description","Найдите путь в глубины храма",""
"da_quest_01_ff_m_moc_moirai_cave.m_Objectives(7).m_Objectives.Description","Поищите другой путь через храм",""
"da_quest_01_ff_m_moc_moirai_cave.m_Objectives(8).m_Objectives.Description","Осмотрите светящуюся статую",""
"da_quest_01_ff_m_moc_moirai_cave.m_Objectives(9).m_Objectives.Description","Следуйте по тропинке через пещеру",""
"da_quest_01_ff_m_moc_moirai_cave.m_Objectives(10).m_Objectives.Description","Следуйте указаниям Мойр",""
"da_quest_01_ff_m_moc_moirai_cave.m_Objectives(11).m_Objectives.Description","Покиньте пещерный проход",""
"da_quest_01_ff_m_moc_moirai_cave.m_Objectives(12).m_Objectives.Description","Победите предвестников Немезиды",""
"da_quest_01_ff_m_moc_moirai_cave.m_Objectives(13).m_Objectives.Description","Подойдите к ихору титана",""
"da_quest_01_ff_m_moc_moirai_cave.m_Objectives(14).m_Objectives.Description","Прикоснитесь к ихору титана",""
"da_quest_01_ff_m_moc_moirai_cave.m_Objectives(15).m_Objectives.Description","Завершите божественное испытание",""
"da_quest_01_ff_m_moc_moirai_cave.m_Objectives(16).m_Objectives.Description","Поглотите божественную энергию",""
"da_quest_01_ff_m_moc_moirai_cave.m_Objectives(17).m_Objectives.Description","Активируйте статую",""
"da_quest_01_ff_m_moc_moirai_cave.m_Objectives(18).m_Objectives.Description","Покиньте храмовое подземелье",""
"da_quest_01_ff_m_moc_moirai_cave.m_Objectives(19).m_Objectives.Description","Найдите путь через храм",""
"da_quest_01_ff_m_moc_moirai_cave.m_Objectives(20).m_Objectives.Description","Победите падшего чемпиона",""
"da_quest_01_ff_m_moc_moirai_cave.m_Objectives(21).m_Objectives.Description","Войдите в портал",""
"da_quest_01_ff_m_moc_moirai_cave.m_Objectives(22).m_Objectives.Description","Поговорите с Мойрами",""
"da_quest_01_ff_m_moc_moirai_cave.m_Objectives(23).m_Objectives.Description","Возьмите амфору",""
"da_quest_01_ff_m_vy_vineyard.m_Title","Дикий бог",""
"da_quest_01_ff_m_vy_vineyard.m_HighVisionGoal","Я должен обратиться за помощью к богу Пану в его винограднике.",""
"da_quest_01_ff_m_vy_vineyard.m_Summary","Мне все еще нужна помощь бога, чтобы добраться до храма Мойр, чтобы узнать пророчество, из-за которого Немезида охотится за мной. Главк покинул эти края, но бог Пан живет в винограднике на севере. Возможно, он сможет мне помочь?",""
"da_quest_01_ff_m_vy_vineyard.m_CompletedSummary","Старик Филон все это время был замаскированным Главком! Он согласился помочь мне войти в храм Мойр. Пан оказался хитрецом, который пытался заманить меня в ловушку и убить, но я отбился от него. Однако я не думаю, что видел его в последний раз.",""
"da_quest_01_ff_m_vy_vineyard.m_Objectives(0).m_Objectives.Description","Войдите в виноградник Пана",""
"da_quest_01_ff_m_vy_vineyard.m_Objectives(1).m_Objectives.Description","Попросите Пана помочь добраться до Мойр",""
"da_quest_01_ff_m_vy_vineyard.m_Objectives(2).m_Objectives.Description","Войдите в пещеру Пана",""
"da_quest_01_ff_m_vy_vineyard.m_Objectives(3).m_Objectives.Description","Завершите ритуал в пещере Пана",""
"da_quest_01_ff_m_vy_vineyard.m_Objectives(4).m_Objectives.Description","Уничтожьте ритуальную жаровню",""
"da_quest_01_ff_m_vy_vineyard.m_Objectives(5).m_Objectives.Description","Выйдите из пещеры и встретьтесь с Паном в его святилище на вершине холма",""
"da_quest_01_ff_m_vy_vineyard.m_Objectives(6).m_Objectives.Description","Победите Пана",""
"da_quest_01_ff_m_vy_vineyard.m_Objectives(7).m_Objectives.Description","Поговорите с Паном",""
"da_quest_01_ff_m_vy_vineyard.m_Objectives(8).m_Objectives.Description","Поговорите с Главком",""
"da_quest_01_ff_m_vy_vineyard.m_QuestInformation(0).m_QuestInformation.HighVisionGoal","Пан напал на меня! Я должен победить его.",""
"da_quest_01_ff_m_vy_vineyard.m_QuestInformation(1).m_QuestInformation.HighVisionGoal","Я победил Пана. Поможет ли он мне теперь добраться до Мойр?",""
"da_quest_01_ff_s_ct_crab_threat.m_Title","Гнездо крабов",""
"da_quest_01_ff_s_ct_crab_threat.m_HighVisionGoal","Я должен уничтожить гнездо крабов, чтобы ихтианы не смогли больше разводить крабов",""
"da_quest_01_ff_s_ct_crab_threat.m_CompletedGoal","Я разрушил гнездо крабов и доложил пентеконтору Лайнусу.",""
"da_quest_01_ff_s_ct_crab_threat.m_Summary","Ихтианы разводят крабов на затопленных полях. Эти твари представляют угрозу и скоро захлестнут фермы, если я ничего не предприму.",""
"da_quest_01_ff_s_ct_crab_threat.m_CompletedSummary","Гнездо крабов уничтожено, а интендант анклава смог использовать кусок крабового панциря, чтобы укрепить защитников анклава.",""
"da_quest_01_ff_s_ct_crab_threat.m_Objectives(0).m_Objectives.Description","Найдите крабье гнездо",""
"da_quest_01_ff_s_ct_crab_threat.m_Objectives(1).m_Objectives.Description","Уничтожьте большое скопление крабовых яиц",""
"da_quest_01_ff_s_ct_crab_threat.m_Objectives(2).m_Objectives.Description","Убейте матерь крабов",""
"da_quest_01_ff_s_ct_crab_threat.m_Objectives(3).m_Objectives.Description","Возьмите трофей краба",""
"da_quest_01_ff_s_ct_crab_threat.m_Objectives(4).m_Objectives.Description","Сообщите о разрушении гнезда крабов",""
"da_quest_01_ff_s_ct_crab_threat.m_Objectives(5).m_Objectives.Description","Принесите скорлупу для пентеконтора Лайнуса",""
"da_quest_01_ff_s_ct_crab_threat.m_Objectives(6).m_Objectives.Description","Поговорите с интендантом",""
"da_quest_01_ff_s_ct_crab_threat.m_QuestInformation(0).m_QuestInformation.HighVisionGoal","Я нашел кусок крабового панциря. Он крепкий. Интересно, может, кому-то в анклаве он пригодится?",""
"da_quest_01_ff_s_ed_enclave_defense.m_Title","Защита Анклава",""
"da_quest_01_ff_s_ed_enclave_defense.m_HighVisionGoal","Я должен поддерживать защитников анклава, где только могу.",""
"da_quest_01_ff_s_ed_enclave_defense.m_CompletedGoal","Анклав в безопасности. Пока что.",""
"da_quest_01_ff_s_ed_enclave_defense.m_Summary","Ситуация в анклаве беженцев, расположенном посреди фермерских угодий, нестабильна. Ихтианы атакуют с южных ворот, и ополченцам с трудом удается их сдерживать.",""
"da_quest_01_ff_s_ed_enclave_defense.m_CompletedSummary","Я помогал ополченцам защищать южные ворота анклава, давая им время укрепить оборону и перевести дух.",""
"da_quest_01_ff_s_ed_enclave_defense.m_Objectives(0).m_Objectives.Description","Защитите юго-восточные ворота",""
"da_quest_01_ff_s_ed_enclave_defense.m_Objectives(1).m_Objectives.Description","Юго-восточные ворота свободны. Доложите об этом пентеконтору Лайнусу",""
"da_quest_01_ff_s_ed_enclave_defense.m_Objectives(2).m_Objectives.Description","Защитите юго-западные ворота",""
"da_quest_01_ff_s_ed_enclave_defense.m_Objectives(3).m_Objectives.Description","Юго-западные ворота свободны. Доложите об этом пентеконтору Лайнусу",""
"da_quest_01_ff_s_gns_gorgon_snake.m_Title","Змея Горгона",""
"da_quest_01_ff_s_gns_gorgon_snake.m_HighVisionGoal","Спасите Иссу",""
"da_quest_01_ff_s_gns_gorgon_snake.m_CompletedGoal","Я убил змею Горгону и спас Иссу.",""
"da_quest_01_ff_s_gns_gorgon_snake.m_Summary","Иссу укусила змея Горгона, и она медленно превращается в камень! Лалаж сказала, что думает, что сварить лекарство из ее крови может получиться...",""
"da_quest_01_ff_s_gns_gorgon_snake.m_CompletedSummary","Иссу укусила змея Горгона, и она начала превращаться в камень. Мне удалось найти и убить змею, а Лалаж сварила из ее крови лекарство.",""
"da_quest_01_ff_s_gns_gorgon_snake.m_Objectives(0).m_Objectives.Description","Поговорите с Лалаж",""
"da_quest_01_ff_s_gns_gorgon_snake.m_Objectives(1).m_Objectives.Description","Найдите змею Горгону",""
